,id,user_name,user_location,user_description,user_created,user_followers,date,text,favorites,retweets,is_retweet
1081,1352458548224155648,luannrjones,"Little Rock, AR",Neonatal Services Nursing Director* parent of a preemie* Neonatal Nurse Practitioner* passionate about improving neonatal intensive care,2015-11-18 04:31:22,379,2021-01-22 03:30:20,Love seeing #championforchildren Lauren Huffman NICU RN @archildrens celebrating her COVID vaccine @NeonatalNurses… https://t.co/aoKyNn9nN1,4,0,False
1082,1352457262678347777,choose_fabulous,Muskoka,,2015-03-20 02:53:18,700,2021-01-22 03:25:13,"RT @CPHO_Canada: For all we have been through and all we stand to achieve in the months ahead, we owe it to ourselves and all those who hav…",0,16,True
1083,1352456039761735681,KopanskyMarilyn,,"nature nut , entrepreneur, citizen scientist, 🇨🇦",2020-06-05 14:59:15,208,2021-01-22 03:20:21,"RT @CPHO_Canada: For all we have been through and all we stand to achieve in the months ahead, we owe it to ourselves and all those who hav…",0,16,True
1084,1352445572737806336,angfwood1,Everywhere,Yakking on about life's most important things - footie (LFC) and four legged friends ......,2014-08-21 15:23:14,325,2021-01-22 02:38:46,RT @GreenHosp: It is important to remember that you need 2 doses of the vaccine. The Pfizer vaccine is about 95% effective within one week…,0,3,True
1085,1352445257997312000,GreenwichCTOFS,101 Field Point Road ,A premier business and family friendly community. Official Account.,2011-03-30 14:24:46,3557,2021-01-22 02:37:31,"RT @GreenHosp: The vaccines consist of genetic material called mRNA that get shuttled into our cells. Once there, it stimulates our immune…",0,1,True
1086,1352444248843571203,KenBorsuk1,"Greenwich, Ct.","Not the Helen Thomas of the Greenwich press corps, but darn close. John Podhoretz thinks I'm an idiot and I'm okay with that. Tweets are my own.",2012-02-17 15:13:10,755,2021-01-22 02:33:30,RT @GreenHosp: It is important to remember that you need 2 doses of the vaccine. The Pfizer vaccine is about 95% effective within one week…,0,3,True
1087,1352443871314194436,GreenwichCTOFS,101 Field Point Road ,A premier business and family friendly community. Official Account.,2011-03-30 14:24:46,3557,2021-01-22 02:32:00,RT @GreenHosp: It is important to remember that you need 2 doses of the vaccine. The Pfizer vaccine is about 95% effective within one week…,0,3,True
1088,1352430155298447361,AnneMcLennan8,The Island,"I’m a gardening Grammie ,dislike biting bugs,love Mother Nature.",2020-06-22 23:04:41,104,2021-01-22 01:37:30,"RT @CPHO_Canada: For all we have been through and all we stand to achieve in the months ahead, we owe it to ourselves and all those who hav…",0,16,True
1089,1352418069159825410,MaineAAP,"Manchester, ME","The American Academy of Pediatrics, Maine Chapter. Dedicated to fulfilling the Chapter’s mission: to improve the lives of children and adolescents in Maine.",2016-08-11 03:28:44,426,2021-01-22 00:49:29,100 million vaccines in 100 days? Maine pediatricians are here for it! @BrianYouthMD shared his shot of the 💉 to sh… https://t.co/jMJlMu9dIg,2,0,False
1090,1352414743336792067,AnnaWShepherd,"Kentucky, USA","Mom, Wife, Sister, Daughter, Chief Early Childhood Officer",2018-03-10 02:02:39,366,2021-01-22 00:36:16,Look at that 😃! Vaccine dose 1 ✅ for this early childhood administrative professional ⁦@SchoolsFloyd⁩ #ShotOfHope… https://t.co/GgBlSNQBqE,4,0,False
1091,1352414351244853249,GEORGE_SANT0SH,Massachusetts,Parasite and Viral Genomics | Alumni PostDoc @Yale ; PhD @ugent @cmcvellore | Married to @ancellaroy | Be Kind | Views my own |,2011-10-28 04:03:58,397,2021-01-22 00:34:42,RT @ynhhealth: It is important to remember that you need 2 doses of the vaccine. The Pfizer vaccine is about 95% effective within one week…,0,4,True
1092,1352412253946081280,MikeIvyMD,"New Haven, CT",Husband/ Father / Surgeon / Veteran. Tweets represent my views not those of my employer.,2014-03-31 18:21:13,1353,2021-01-22 00:26:22,"RT @KristinMDCT: More tears of joy!

#CovidVaccine #2
Wearing flowers on black bc ‘with hope and love, life springs from darkness.’

3000 m…",0,4,True
1093,1352410615692857346,CliffordBogue,,"Waldemar Von Zedtwitz Professor of #Pediatrics; Chair, @YalePediatrics; Chief Medical Officer, Yale-New Haven Children's Hospital",2012-05-09 18:55:04,250,2021-01-22 00:19:52,RT @ynhhealth: It is important to remember that you need 2 doses of the vaccine. The Pfizer vaccine is about 95% effective within one week…,0,4,True
1094,1352406112482570244,MEEKSVS,"Toronto, Ontario",I have Autism and I am an outspoken autism and disability rights advocate I live in Toronto Ontario Canada I’m also an actor,2014-06-10 00:45:20,3188,2021-01-22 00:01:58,"RT @CPHO_Canada: For all we have been through and all we stand to achieve in the months ahead, we owe it to ourselves and all those who hav…",0,16,True
1095,1352401619179155458,MrsRPh817,,Occasionally (re)tweeting what matters to me.,2010-08-15 11:22:00,137,2021-01-21 23:44:07,"This initiative can save 50,000 American lives in the next 100 days. #MaskUpAmerica #100DAYMASKCHALLENGE #CrushCOVID https://t.co/s6i64v5Rmc",1,0,False
1096,1352390370336923648,ryanbuchholz,Washington DC/ Falls Church VA,"Pediatrician, internist, community health advocate, improver, dad. Tweets=mine",2009-06-20 14:29:34,199,2021-01-21 22:59:25,"New day, new dose (#2)! One step toward 100M doses in 100 days #CrushCOVID #ThisIsOurShot #VaccinesWork ⁦… https://t.co/MTsxleVDqn",4,0,False
1097,1352388014358618112,VallonAllan,"Buffalo, NY","Likes and ❤️’s: U2, cruising, fitness, running and cheese balls. Loyal to Royal: fiercely loyal to the Bills (fine, to all things Buffalo). Opinions are my own.",2008-09-15 15:22:02,618,2021-01-21 22:50:03,Mom has been vaccinated. God bless CVS. 🙌 #crushcovid @cvspharmacy,12,0,False
1098,1352385118606925825,AnnaWShepherd,"Kentucky, USA","Mom, Wife, Sister, Daughter, Chief Early Childhood Officer",2018-03-10 02:02:39,366,2021-01-21 22:38:33,@DACE_est2017 early childhood educator @StacyPaige13 got the #Moderna #Covid19 Vaccine! Let’s end this together! 💪🏻… https://t.co/QF8TPoh8AN,5,2,True
1099,1352380072892772361,wyldcdn,,It is time to put ignorance and political affiliations aside and do what is right.,2009-07-14 04:17:07,867,2021-01-21 22:18:30,"RT @CPHO_Canada: For all we have been through and all we stand to achieve in the months ahead, we owe it to ourselves and all those who hav…",0,16,True
1100,1352379457399611393,KristinMDCT,"Bridgeport, CT","Chief Wellness Officer and Med. Dir. of #PalliativeCare at YNNH—Bridgeport, #HaPC #WomenInMedicine & Team #Resilience. Tweets my own. she/hers.",2012-03-09 21:04:59,1092,2021-01-21 22:16:03,"More tears of joy!

#CovidVaccine #2
Wearing flowers on black bc ‘with hope and love, life springs from darkness.’… https://t.co/ieVDjB4GFh",24,4,True
1101,1352370180425441281,YaleMedicine,"New Haven, CT",Using ground-breaking science from @YaleMed to help us keep you healthy. We're the clinical arm of Yale School of Medicine.,2016-07-25 15:03:21,3859,2021-01-21 21:39:11,RT @ynhhealth: It is important to remember that you need 2 doses of the vaccine. The Pfizer vaccine is about 95% effective within one week…,0,4,True
1102,1352367428710313991,DrJoanVinallCox,"Oakville, near Toronto","Ph.D, retired prof. Taught structure of poetry, reading, writing, , structure of story in popular movies, web use, speaking, & podcasting. Feminist",2007-11-02 20:56:45,2692,2021-01-21 21:28:15,"RT @CPHO_Canada: For all we have been through and all we stand to achieve in the months ahead, we owe it to ourselves and all those who hav…",0,16,True
1103,1352361255785422849,PhillipsHealth,"Hartford, CT","Mission: To fulfill God's purpose for all people, through active ministry and community service!  Seeking the Peace of the City... Jeremiah 29:7",2020-08-13 07:17:06,40,2021-01-21 21:03:43,@JoeBiden @WhiteHouse National Strategy for #COVID19 Response + #pandemic Preparedness #HotOffThePress #DayOne!! Re… https://t.co/oZ8NV0f8o1,1,1,True
1104,1352359525475614722,stl1782,Here,"Life is short. Break the rules, forgive quickly, kiss slowly, love truly, laugh uncontrollably and never regret anything that made you smile...",2010-06-12 00:17:03,40,2021-01-21 20:56:51,"RT @CPHO_Canada: 2/2 Though we are all weary, staying the course &amp; doing all we can to ↓ #COVID19 activity is crucial; this will buy more t…",0,10,True
1105,1352355575917588480,YalePediatrics,"New Haven, CT",The Department of #Pediatrics at the Yale School of Medicine is committed to transforming the health and well-being of children and adolescents.,2018-12-11 20:32:43,1482,2021-01-21 20:41:09,RT @ynhhealth: It is important to remember that you need 2 doses of the vaccine. The Pfizer vaccine is about 95% effective within one week…,0,4,True
1106,1352348272510251009,KaylaAd47625290,"Asheville, NC","Living with, Learning about, & advocating for Cystic Hygroma (Lymphatic Malformation)",2020-12-21 18:44:34,22,2021-01-21 20:12:08,RT @VBINY: Protecting ourselves and each other! #crushCOVID https://t.co/99i8k9etfq,0,1,True
1107,1352346829501857793,willnanken,,,2009-03-30 02:15:54,27,2021-01-21 20:06:24,RT @YNHH: It is important to remember that you need 2 doses of the vaccine. The Pfizer vaccine is about 95% effective within one week after…,0,2,True
1108,1352346172883693571,robeldermd,"New Haven, CT","Pediatric and adult congenital cardiologist @YaleMed @YNHH. PD for #pedcard and #ACHD. Advocate for kids, adults and public health.",2015-05-19 02:43:28,1335,2021-01-21 20:03:47,Grateful for the start of a new epoch. #crushcovid @YNHH  with Moderna #2 and new hope in Washington. Things are lo… https://t.co/bUJrtuR68S,21,0,False
1109,1352345160168955917,CaanhInc,New Haven,"CAANH offers pathways to prosperity to those in poverty in the Greater New Haven area.
♦Service  ♦Collaboration  ♦Advocacy  ♦Knowledge Generation",2020-03-20 17:42:26,220,2021-01-21 19:59:46,RT @YNHH: It is important to remember that you need 2 doses of the vaccine. The Pfizer vaccine is about 95% effective within one week after…,0,2,True
1110,1352345079344726019,MissMarlieB,Ontario Canada,"Six feet apart or six feet under. 
Mask now or ventilator later. 
Choose wisely. 

Kindness and the greater good. 
#StayAtHome #ShelterInPlace",2011-03-03 01:08:55,498,2021-01-21 19:59:26,"RT @CPHO_Canada: For all we have been through and all we stand to achieve in the months ahead, we owe it to ourselves and all those who hav…",0,16,True
1111,1352344956929716230,westerlyhosp,,"For more than 90 years, @westerlyhosp has been providing residents of southern #RI and southeastern #CT with a full range of inpatient & outpatient services.",2017-01-10 16:36:38,43,2021-01-21 19:58:57,It is important to remember that you need 2 doses of the vaccine. The Pfizer vaccine is about 95% effective within… https://t.co/zB2uZ74nQs,0,0,False
1112,1352344956782997506,ynhhealth,,"CT’s leading healthcare system, consisting of Bridgeport, Greenwich, Lawrence + Memorial, Yale New Haven and Westerly hospitals, and Northeast Medical Group.",2018-09-19 14:02:16,1365,2021-01-21 19:58:57,It is important to remember that you need 2 doses of the vaccine. The Pfizer vaccine is about 95% effective within… https://t.co/VR5c82Bhqh,3,4,True
1113,1352344956564856839,lmhospital,Southeastern Connecticut,"Lawrence and Memorial (L+M) is a not-for-profit, general, acute care, private hospital that has been improving the health of this region since 1912.",2010-12-30 15:10:46,912,2021-01-21 19:58:57,It is important to remember that you need 2 doses of the vaccine. The Pfizer vaccine is about 95% effective within… https://t.co/GAdIyUtDCI,0,0,False
1114,1352344956174819332,BPTHOSP,"Fairfield County, Connecticut",Non-profit acute care hospital. Member of Yale New Haven Health.,2008-04-23 14:52:33,7644,2021-01-21 19:58:57,It is important to remember that you need 2 doses of the vaccine. The Pfizer vaccine is about 95% effective within… https://t.co/lrSGDKEwIB,0,0,False
1115,1352344955897970691,YNHH,"New Haven, CT","YNHH is the 1,541-bed teaching hospital for Yale School of Medicine.",2008-11-13 16:45:27,23424,2021-01-21 19:58:57,It is important to remember that you need 2 doses of the vaccine. The Pfizer vaccine is about 95% effective within… https://t.co/746nAKSSKe,4,2,True
1116,1352344954899734528,GreenHosp,"Greenwich, CT",Greenwich Hospital is a 206-bed community hospital affiliated with the Yale New Haven Health System.,2009-03-16 18:31:44,8414,2021-01-21 19:58:57,It is important to remember that you need 2 doses of the vaccine. The Pfizer vaccine is about 95% effective within… https://t.co/lrz5cnlBIf,2,3,True
1117,1352342821764812802,VBINY,"New York, NY","The Vascular Birthmark Institute provides world-class care in the diagnosis, treatment, management, and research of all #vascularbirthmarks. (212) 434-4050.",2015-06-09 22:37:28,611,2021-01-21 19:50:28,Protecting ourselves and each other! #crushCOVID https://t.co/99i8k9etfq,5,1,True
1118,1352340734091816960,ThisIsOurShot,United States,To elevate voices of healthcare heroes to build vaccine-trust towards a covid-free world. #ThisIsOurShot,2020-12-24 20:41:17,594,2021-01-21 19:42:10,RT @DrJanPeds: One of 100mill in 1st 100 days lining up to show America that the #covidvaccine is safe &amp; effective! Pls add to #CommunityIm…,0,2,True
1119,1352340447402864647,williamdore,"Ottawa, Ontario","Interesting stuff. Or not.| Married to the love of my life and my best friend. Former broadcast journalist and farmer. Currently Comms professional, Ottawa 🇨🇦",2008-02-27 14:02:49,131,2021-01-21 19:41:02,"RT @CPHO_Canada: For all we have been through and all we stand to achieve in the months ahead, we owe it to ourselves and all those who hav…",0,16,True
1120,1352338476256079877,JoanneGibson18,"Amherst, Nova Scotia","I'm passionate about family, friends, my safe home, work with a purpose, cooking, nature, laughter and being your authentic self.",2012-10-07 12:05:05,58,2021-01-21 19:33:12,"RT @CPHO_Canada: For all we have been through and all we stand to achieve in the months ahead, we owe it to ourselves and all those who hav…",0,16,True
1121,1352338401681412096,PatCSportsFan,"Toronto, Ontario","Toronto sports fan and bleeding heart Liberal. You don’t like it, don’t follow me | Trolls will be blocked | No DMs",2012-11-22 17:03:10,4791,2021-01-21 19:32:54,"RT @CPHO_Canada: For all we have been through and all we stand to achieve in the months ahead, we owe it to ourselves and all those who hav…",0,16,True
1122,1352337860423278592,SandroSanita,,,2012-08-18 02:53:25,90,2021-01-21 19:30:45,"RT @CPHO_Canada: For all we have been through and all we stand to achieve in the months ahead, we owe it to ourselves and all those who hav…",0,16,True
1123,1352337699898871810,CPHO_Canada,Canada,🇨🇦 The Chief Public Health Officer of Canada promotes and protects the health of Canadians. Terms of use: https://t.co/XV8ZG70wjS  Français: @ACSP_Canada,2014-01-27 18:24:20,250382,2021-01-21 19:30:07,"For all we have been through and all we stand to achieve in the months ahead, we owe it to ourselves and all those… https://t.co/AwqI11nb62",99,16,True
1124,1352330456700751874,FM468FN,Fort McMurray 468 First Nation,"A harmonious community of rich culture that builds its economic and social success upon its commitment to accountability, respect for one another and hard work.",2020-06-29 18:31:22,30,2021-01-21 19:01:20,Securing safe and effective vaccines to prevent #COVID19 is key to stopping the spread of COVID-19 and resuming nor… https://t.co/sj2BoZ1hvb,0,0,False
1125,1352327950495080461,COVIDvoiceProj,"Atlanta, USA","The COVIDvoice Project is developing a tool to screen for COVID-19 just by listening to a person's voice! Spread the word, Share your Voice, Crush COVID!",2021-01-06 22:36:28,8,2021-01-21 18:51:23,Georgia Med-Tech Startup Calls on Sports Teams to Rally Fans to Share Their Voice and #CrushCovid… https://t.co/FwTBORs9bQ,0,0,False
1126,1352324432367292416,ajpaletta,"Winnipeg, Salt Lake City, & Phoenix ✈️✈️✈️","Happily Married Father of 3, Adventure Seeker, Co-Owner of AP2, Marathon Runner, NHL WPG JETS Season Tickets Holder & Life Lover",2009-10-23 22:25:05,239,2021-01-21 18:37:24,"RT @CPHO_Canada: 2/2 Though we are all weary, staying the course &amp; doing all we can to ↓ #COVID19 activity is crucial; this will buy more t…",0,10,True
1127,1352322603306934282,columbushouseCT,Connecticut,To serve people who are homeless or at risk of becoming homeless by providing shelter and housing and by fostering their personal growth and independence.,2013-06-11 13:27:13,747,2021-01-21 18:30:08,Columbus House staff have begun receiving their #Covid19 #vaccines at @cshhc_. We're excited to share their reasons… https://t.co/SCw6cxSh9s,2,0,False
1128,1352322014594424832,KateFroio,Upstate New York,"Assistant Director of Public and Media Relations @UpstateGolisano @UpstateNews, Best News Source @SyrPressClub, Vegan Eater @StrongHearts315, Wife @CNYDent",2008-11-04 20:25:08,987,2021-01-21 18:27:47,Parents are on their way to first-dose vaccination appointments. We are overjoyed. #CrushCovid,10,0,False
1129,1352321067419914240,BuczkowskiAmy,"Portland, ME",Hospital-based pediatrician practicing in Maine. #PutKids1st #tweetiatrician Views/posts are my own and are not affiliated with any institution.,2019-04-07 12:15:31,102,2021-01-21 18:24:02,RT @DrJanPeds: One of 100mill in 1st 100 days lining up to show America that the #covidvaccine is safe &amp; effective! Pls add to #CommunityIm…,0,2,True
1130,1352320163459330050,williamdore,"Ottawa, Ontario","Interesting stuff. Or not.| Married to the love of my life and my best friend. Former broadcast journalist and farmer. Currently Comms professional, Ottawa 🇨🇦",2008-02-27 14:02:49,131,2021-01-21 18:20:26,"RT @CPHO_Canada: 2/2 Though we are all weary, staying the course &amp; doing all we can to ↓ #COVID19 activity is crucial; this will buy more t…",0,10,True
1131,1352318651823636480,smcenturff,"Vancouver, British Columbia","🇨🇦#TrumpImpeachment. January 20, 2021 is the day. @JoeBiden 🇺🇸 @KamalaHarris We are united...💙💙💙💙💙💙💙💙💙💙",2011-08-09 16:12:41,2254,2021-01-21 18:14:26,"RT @CPHO_Canada: 2/2 Though we are all weary, staying the course &amp; doing all we can to ↓ #COVID19 activity is crucial; this will buy more t…",0,10,True
1132,1352315919712673795,accrete,"British Columbia, Canada","Small business search engine friendly accessible websites, Wordpress blogs, ecommerce, social media setup, website maintenance and more...",2007-08-03 02:47:37,928,2021-01-21 18:03:34,"RT @CPHO_Canada: 2/2 Though we are all weary, staying the course &amp; doing all we can to ↓ #COVID19 activity is crucial; this will buy more t…",0,10,True
1133,1352315730809614336,JoCool14,,Concerned citizen. Father had NPD. Untreatable. Democracy and social justice are everything. Decency matters. “Character matters.” (President Obama),2012-11-04 22:59:50,261,2021-01-21 18:02:49,"RT @CPHO_Canada: 2/2 Though we are all weary, staying the course &amp; doing all we can to ↓ #COVID19 activity is crucial; this will buy more t…",0,10,True
1134,1352315622743539714,CPHO_Canada,Canada,🇨🇦 The Chief Public Health Officer of Canada promotes and protects the health of Canadians. Terms of use: https://t.co/XV8ZG70wjS  Français: @ACSP_Canada,2014-01-27 18:24:20,250382,2021-01-21 18:02:23,"2/2 Though we are all weary, staying the course &amp; doing all we can to ↓ #COVID19 activity is crucial; this will buy… https://t.co/R8mzU0JwC0",52,10,True
1135,1352311138596376576,DrJanPeds,Occupied land-Orono/Penobscot,#Putkids1st☝️Wife|⚽️Mom|Sib|Pediatrician👩‍⚕️Teacher|Advocate|Mentor🤸‍♀️ Researcher🤓PastPresMAAP🌲NNC D-I Rep. ✨UMaine; &UNECOM✨(She/her) #VoteKids #WearMasks,2014-03-15 21:22:29,1987,2021-01-21 17:44:34,One of 100mill in 1st 100 days lining up to show America that the #covidvaccine is safe &amp; effective! Pls add to… https://t.co/fUWY1aDdTA,7,2,True
1136,1352307647131897868,kathleen_neuzil,,,2015-09-17 21:20:22,484,2021-01-21 17:30:42,Terrific news!  Fighting a global pandemic requires global partnership. #crushcovid https://t.co/GvV18gAbV5,17,1,True
1137,1352292315814109184,AdeResists,"Texas & Montana, USA","American 🗽 #BIDENHARRIS2020 we are in the fight of our lives, a fight for the Soul of our nation 🗽#Dogs🐾 #climateaction 🌎🌍🌏 #VOTE #RBG",2017-01-21 16:30:27,5354,2021-01-21 16:29:47,A President who actually works #ForThePeople how refreshing and competent!!! Let’s roll!!! #BidenHarris #CrushCovid… https://t.co/aH4dD8A30L,1,0,False
1138,1352290584350887945,Michelle_Jaffee,Connecticut,Mom. Daughter. Friend. Retired baker. garden/knit/sew/repeat. Tweets are my own.,2011-06-08 14:10:59,2226,2021-01-21 16:22:54,Feeling grateful! 💉🧡#crushcovid https://t.co/twbRT9tY5Y,1,0,False
1139,1352270818173202434,InglesAdvantage,"Black Mountain, NC","Ingles Supermarket (IMKTA)  @InglesMarkets on Facebook & Instagram https://t.co/SejoWQUmQH
 8662267168 cust svc",2012-11-08 14:27:13,4499,2021-01-21 15:04:21,@tanulewicz @jc_bradbury we hope things will improve and are happy to see so many eager to get vaccinated.… https://t.co/f3iR9RCeiL,1,0,False
1140,1352270267804954625,wheelerschool,"216 Hope Street Providence, RI 02906","The Wheeler School is a Nursery - Grade 12 coed, independent school founded in 1889 with two campuses, city and rural, in Providence, RI and Seekonk, MA",2009-01-30 23:59:35,1292,2021-01-21 15:02:10,"Today, as we begin onsite COVID-19 testing for students, we're grateful for the support of our Parent Volunteers. T… https://t.co/6HpszuyHyl",1,0,False
1141,1352259769059450883,MaineAAP,"Manchester, ME","The American Academy of Pediatrics, Maine Chapter. Dedicated to fulfilling the Chapter’s mission: to improve the lives of children and adolescents in Maine.",2016-08-11 03:28:44,426,2021-01-21 14:20:27,Do your patients have questions about the COVID-19 vaccine in children &lt; 16 years? @healthychildren has a nice reso… https://t.co/1uY3VfDvlj,0,0,False
1142,1352228025484636160,Julieehunt2,,English with strong opinions,2020-06-08 07:18:50,74,2021-01-21 12:14:19,RT @ChiefKnuth: Second dose! #COVID19Vaccine #FDNYEMS #FDNY #COVID19 #IGotTheShot #MyWhy #BHS #DontWaitVaccinate #CrushCOVID #TakeYourShot…,0,3,True
1143,1352223786985254913,Naidealfaia,"Rio de Janeiro, Brasil","#PlanteAsuaArvoreParaDaBonsFrutos. 
Eu sou fruto da árvore que meus pais plantaram e plantei a minha própria árvore que deu dois belos frutos: Mateus e Jéssica.",2016-05-11 20:08:29,15,2021-01-21 11:57:28,"RT @ESACanada: Defend space in real life. Keep your distance.
Let’s crush COVID-19 together. @GovCanHealth #CrushCOVID https://t.co/ldsCt4u…",0,5,True
1144,1352188415194902528,garyfdny,"staten island,new york","F.D.N.Y Rescue Paramedic
Special Operations Command (ret)
NYTF 1 USAR Task Force (ret)
Survivor, FDNY Local 2507 WTC & Retirees Liaison",2009-04-04 04:25:05,804,2021-01-21 09:36:55,RT @ChiefKnuth: Second dose! #COVID19Vaccine #FDNYEMS #FDNY #COVID19 #IGotTheShot #MyWhy #BHS #DontWaitVaccinate #CrushCOVID #TakeYourShot…,0,3,True
1145,1352150500842606594,chhikara_raman,,Bodybuilder,2020-12-22 11:51:35,0,2021-01-21 07:06:15,RT @DMNewDelhi: New Delhi District Administration is committed to ensuring smooth implementation of #LargestVaccineDrive against #COVID19 b…,0,1,True
1146,1352114740814901248,StaceyO444,,"Mom of 2, Epidemiologist with a Masters in Health Sciences. I am a believer in data, numbers, and science. Also, the Oxford comma.",2015-09-02 23:41:58,166,2021-01-21 04:44:09,Nurses are heroes. #BidenHarrisToSaveAmerica #CrushCOVID https://t.co/ZHGCChNe3B,0,0,False
1147,1352092538312814595,FDNYWomen,,"“Dedicated to preserving the history of women in the FDNY, as well as, improving the FDNY through the involvement and success of women” fdnywomen@gmail.com",2015-08-03 23:50:28,2606,2021-01-21 03:15:56,RT @ChiefKnuth: Second dose! #COVID19Vaccine #FDNYEMS #FDNY #COVID19 #IGotTheShot #MyWhy #BHS #DontWaitVaccinate #CrushCOVID #TakeYourShot…,0,3,True
1148,1352088361620664323,CNeavelMD,"Austin, Texas","Founder/Director @PCCYouthClinic AdolYoungAdult,DevBehav,&ReproHealth |#Interdisciplinary |#BLM #LGBTQ+ Ally| #BookWorm | #Advocacy 2021TxSuperDoc|",2013-05-30 11:43:40,921,2021-01-21 02:59:20,"RT @CentralHealthTX: ""I got vaccinated because as a public health professional I have an obligation to keep my community safe. 

Representa…",0,6,True
1149,1352075839807090689,VanessaLisi1,"Rhode Island, USA","Mother, Professional, Advocate “Life is 10% what happens to you and 90% how you respond to it!”",2018-08-12 15:17:48,24,2021-01-21 02:09:35,Oh happy day! #CrushCOVID #vaccine https://t.co/SWjUnUT1IN,0,0,False
1150,1352061159751479297,ChiefKnuth,"New York, USA",@FDNYWomen President FDNY EMS Division Commander⛑ #NYCsBEST🚑#NYCsBravest🚒@SUNYGeneseo #Math👩‍🎓🤽‍♀️⛷🧜‍♀️#WomenInFIREandEMS👩‍🚒 @femaledefender1 Ambassador,2018-08-08 06:25:29,1016,2021-01-21 01:11:15,Second dose! #COVID19Vaccine #FDNYEMS #FDNY #COVID19 #IGotTheShot #MyWhy #BHS #DontWaitVaccinate #CrushCOVID… https://t.co/XokEqKmTIO,16,3,True
1151,1352056581014347784,BrezDr,,"Pediatric Emergency Physician, parent/partner, Medical evaluator, (she/her), opinions my own",2020-01-28 20:29:19,9,2021-01-21 00:53:03,"RT @ESACanada: Defend space in real life. Keep your distance.
Let’s crush COVID-19 together. @GovCanHealth #CrushCOVID https://t.co/ldsCt4u…",0,5,True
