,id,user_name,user_location,user_description,user_created,user_followers,date,text,favorites,retweets,is_retweet
365,1352774534701715463,tulunsokit,Johor Bahru,Kidney Doc. RT isn't endorsement. Not for pt doc interactions. Opinions are personal. #NSMC #Flozinator,2009-06-19 12:16:15,2353,2021-01-23 00:25:57,RT @RRajakariar: Day 1 of the covid-19 vaccination drive at our Newham dialysis unit. More than a 90% uptake of the vaccine administered by…,0,2,True
366,1352774419299463168,RodeoDrPodiatry,"Beverly Hills, CA",Dr. Bobby Pourziaee🦶🏼Boutique foot & ankle practice in the ❤️ of #BeverlyHills on Rodeo Drive ☎️ 310-441-0088 👣 Put Your Feet In Our Hands™ #Podiatrist,2012-08-10 03:29:40,543,2021-01-23 00:25:29,RT @TheHighHeelDoc: Thankful to receive my #Moderna Vaccine 💉 today! 🙌🏽 #VaccinesWork https://t.co/612Voy8sUP,0,1,True
367,1352774361728446464,TheHighHeelDoc,"Beverly Hills, CA",The High Heel Doc 👠 Owner of @RodeoDrPodiatry 👣  Podiatrist to the Stars ⭐️ 📺 🎥 #Podiatrist #HighHeelHangover Put Your Feet In Our Hands™,2019-01-22 16:21:50,54,2021-01-23 00:25:15,Thankful to receive my #Moderna Vaccine 💉 today! 🙌🏽 #VaccinesWork https://t.co/612Voy8sUP,2,1,True
368,1352774134779015168,JBL_96,"Pennsylvania, USA",it's a good kind of madness ✨,2009-09-05 00:06:04,222,2021-01-23 00:24:21,My arm may be very swollen but it’s all okay #VaccinesSaveLives,0,0,False
369,1352774046555889664,Vaxyourfam,United States,Twitter account of Vaccinate Your Family (former twitter handle was @ShotofPrev). We discuss #vaccines for people of all ages.,2010-07-28 14:38:39,8502,2021-01-23 00:24:00,“I'm a Black Doctor Who Didn't Trust the COVID Vaccine. Here's What Changed My Mind.” - via @NBCNews -… https://t.co/2zkL03Jpg8,2,1,True
370,1352773798454550528,FREDERICADRIEN3,,j aime la vie apres avoir tutoye la mort je suis a nouveau frederic adrien simon et j habite macon je suis ne le 17 12 1968 a toulon,2020-07-26 01:37:46,365,2021-01-23 00:23:01,RT @Canada: The Government of 🇨🇦 is committed to providing Canadians with up-to-date information on the distribution of #COVID19 vaccines.…,0,46,True
371,1352773447466840066,aprilnovo,"Florida, USA",Nurse // Nole // working on my PhD.,2010-04-17 20:23:07,49,2021-01-23 00:21:37,@NFL #SuperBowlLV Am I good to go?  So excited to see healthcare providers recognized. Much love to all the healthc… https://t.co/VcnPYPqKU2,0,0,False
372,1352773052078186502,RoeunIm,"Minnesota, USA","Educator, medical laboratory scientist, father, BJJ blue belt and devout Vikings fan. Tweets are my own.",2016-03-22 14:44:32,139,2021-01-23 00:20:03,Excited to do my part for my community. #VaccinesWork #ScienceMatters https://t.co/G0ZRz9U2ZB,1,0,False
373,1352772994087743490,enzoplacco,Panama,"Education Specialist at @uniceflac | Past lives at @ONUDDHH, @PNUDHN and @ONUHN",2015-06-16 02:29:49,656,2021-01-23 00:19:49,"“In the coming weeks, @UNICEF will begin transporting vaccines, together with syringes and safety boxes, to countri… https://t.co/5mEPYZsK3T",2,1,True
374,1352772711634841600,acweyand,"Ann Arbor, MI","Ped heme/onc @umichmedicine via @NorthwesternU @UWPedsRes, mother, dreamer, pacifist, justice seeker. BLM 🌈 #HCWvsHunger Opinions mine (she/her/hers)",2017-01-25 17:59:32,13181,2021-01-23 00:18:42,"RT @tmprowell: Real #SciComm by Dr. @KizzyPhD 👑 👇

#WomenInSTEM #VaccinesWork #COVID19
#IGotTheShot https://t.co/2ji5IiyXul",0,4,True
375,1352772691720200193,DMDavis18,,,2018-11-13 23:04:30,7,2021-01-23 00:18:37,RT @NursesWhoVax: Get a Good Night's Sleep Before Your COVID Vaccine because adequate sleep is an important factor in a strong immune syste…,0,3,True
376,1352772201787879424,enzoplacco,Panama,"Education Specialist at @uniceflac | Past lives at @ONUDDHH, @PNUDHN and @ONUHN",2015-06-16 02:29:49,656,2021-01-23 00:16:40,"#COVAX announces new agreement, plans for first deliveries |  via ⁦@gavi⁩ 

#covid19 #covidvaccine #VaccinesWork https://t.co/Hu5mV2E9Cz",0,0,False
377,1352771944190533643,mgmglobal,"Boston, MA; Aguascalientes,Mex","Medico Cirujano Maestro en Administracion de Servicios de Salud, Candidato a Doctor en Finanzas Publicas Retweet No endorsement",2011-01-29 02:50:03,1890,2021-01-23 00:15:39,RT @RodrigoATCG: Great partnerships result in great things! Thank you @GilletteStadium and @massgovernor for being fantastic partners to @C…,0,1,True
378,1352770899741650944,LMateraDO,,"Adolescent Med fellow @nationwidekids, and part-time baker/Disney fanatic. Advocate for #teenhealth, #lgbthealth, and #mentalhealth. Tweets are my own. She/her.",2019-09-12 13:53:53,169,2021-01-23 00:11:30,"Day two update: chills on and off all day, headache, fatigue, arm soreness. Feeling a little better this evening af… https://t.co/cYoK5dfaEi",0,0,False
379,1352770487944949765,jennibaillie,Edinburgh,jenni,2010-02-23 18:49:39,286,2021-01-23 00:09:52,RT @RCPI_news: An information document with FAQs about COVID-19 vaccines for people with pre-existing allergic conditions has been produced…,0,34,True
380,1352770113372631042,WPPHealth,London,The first global healthcare agency focused on Rx specialty pharmaceutical companies who are researching and developing breakthrough therapies.,2017-01-24 21:24:52,1316,2021-01-23 00:08:22,"RT @LSHTM: Safe &amp; effective #COVID19 vaccines are close.

But their development is just the beginning - so what's next? 🤔

Put your questio…",0,35,True
381,1352768941681160192,CmdDasp,"Wisconsin, USA","Clinical pharmacist at rural midwest hospital. APPE/IPPE preceptor, co-lead ASP. Interesting tidbits for learning/teaching/practice. RT are not endorsements.",2019-03-06 20:28:07,335,2021-01-23 00:03:43,"RT @tmprowell: As of 1/21/21, 4.6% of the 🇺🇸 have received at least 1 dose of #COVID19 #vaccine &amp; 0.7% have gotten both needed shots in the…",0,30,True
382,1352768740702777344,walterrobinson,Ottawa,"CDN-husband-dad-runner-boxer-basketball-Public Affairs exec. Hate #cancer #apathy. Love 80s music, charities, sci-fi, travel. Tweets my own. RTs ≠ endorsement!",2009-04-06 15:41:42,1847,2021-01-23 00:02:55,"More delays in #vaccine delivery schedules. This will happen and nations should expect, and adjust accordingly.… https://t.co/8GLkbfv9AO",0,0,False
383,1352768550000320513,CalyDreams,NY,"I love the arts in general... and cats.  :D
Dream in progress-   http://t.co/V5h1DYhI",2010-02-11 20:15:18,67,2021-01-23 00:02:10,RT @NicoleB_MD: Tried my hand at #Tiktok - this one struck a nerve. #VaccinateYourKids #VaccinesWork #somedocs https://t.co/SoFfKsf4Ug,0,25838,True
384,1352768496829157376,ginagi_66,Украина,,2009-08-11 19:41:47,121,2021-01-23 00:01:57,"RT @TradocDCG: This short message actually applies to everyone, but was made especially for my kids! Thanks for listening 😀 @stephdmartin @…",0,135,True
385,1352768421172310018,NorthPointMpls,"Minneapolis, MN","NorthPoint Health & Wellness Center is a multi-specialty medical, dental and mental health center and human service agency located in North Minneapolis.",2017-03-27 14:56:53,374,2021-01-23 00:01:39,"“BE SAFE, NOT SORRY, for those around you get your COVID IMMUNIZATION. It only hurts for a little while.” – Bertha,… https://t.co/knq3ErS27u",0,0,False
386,1352768163050639360,JCole_Barrie,,,2011-11-18 13:23:36,68,2021-01-23 00:00:37,"RT @FPharmacy5: 💁‍♀️New Friendly Pharmacy 5 video! 

Covid-19 Vaccine Questions Answered: Part 1 https://t.co/FkG47i7syj

#ScienceUpFirst #…",0,10,True
387,1352768122374279168,sjmacmahon,"Scarborough, England",“The time is always right to do what is right” MLK Jr. NY Moors Peat Bogs Coast Badgers Foxes Birds esp. Raptors,2009-01-16 17:40:18,57,2021-01-23 00:00:28,"RT @cpeedell: Very emotional listening to my wife who has been giving #COVID19 vaccines in Nursing Homes, Residential Care Homes, EMIs, and…",0,31,True
388,1352768058155270144,Vaxyourfam,United States,Twitter account of Vaccinate Your Family (former twitter handle was @ShotofPrev). We discuss #vaccines for people of all ages.,2010-07-28 14:38:39,8502,2021-01-23 00:00:12,"“Get a Good Night's Sleep before Your COVID Vaccine” - via @WebMD - https://t.co/mpce26Mue6
-- 
#COVID19… https://t.co/ftJfT1GeTu",1,0,False
389,1352768040522416134,monitor_PH,,"Surveying the field of Public Health. Maintained by @thisisdaryn.

Curation of sources is a work in progress. Send feedback to darynr at gmail.",2017-05-31 17:21:27,1321,2021-01-23 00:00:08,RT @AmerMedicalAssn: Our CPT codes help physicians determine the appropriate code combination for the type and dose of #COVID19 vaccine adm…,0,5,True
390,1352768006703689729,AmerMedicalAssn,Chicago/Washington D.C.,American Medical Association: Physicians' powerful ally in patient care. [RT ≠ Endorsement] #MembersMoveMedicine @AMAmedstudents,2009-03-31 17:50:31,740547,2021-01-23 00:00:00,Our CPT codes help physicians determine the appropriate code combination for the type and dose of #COVID19 vaccine… https://t.co/9JgOtPZTaY,4,5,True
391,1352767781033234434,yayayarndiva,"Sonoma County, California","Snarky crone, writer, pediatrician, engineer, data whisperer  #tweetiatrician",2009-03-31 05:01:57,13017,2021-01-22 23:59:06,"RT @Vaxyourfam: “Why Kids Might Be Key to Reaching Herd Immunity” - via @TheAtlantic - https://t.co/Ikk3Jq7A1j
--
#COVID19 #COVIDvaccine #v…",0,2,True
392,1352767309635584000,JudyYeeMD,"New York, NY","Professor and University Chair, Department of Radiology, Montefiore Medical Center, Albert Einstein College of Medicine @MontefioreRad",2016-03-14 00:06:52,2304,2021-01-22 23:57:14,RT @cabanam: RT: @1199Prez George Gresham receives the #COVID19 #vaccine at @MontefioreNYC.  George #Gresham is President of #1199SEIU (Uni…,0,3,True
393,1352767000989347853,Vaxyourfam,United States,Twitter account of Vaccinate Your Family (former twitter handle was @ShotofPrev). We discuss #vaccines for people of all ages.,2010-07-28 14:38:39,8502,2021-01-22 23:56:00,"“Why Kids Might Be Key to Reaching Herd Immunity” - via @TheAtlantic - https://t.co/Ikk3Jq7A1j
--
#COVID19… https://t.co/bNz8Olftn2",3,2,True
394,1352767000720924674,SheilaLKaplan,Brooklyn NY,"I double mask. Lola (my profile pic) isn't allowed to wear clothes, Chris is a fundamentalist. However her cousin Percy, (my avatar) is a stylish Miami dude",2010-12-08 01:43:54,1841,2021-01-22 23:56:00,"RT @Woodsy1069: George Foreman Got The Vaccine Shot, Maybe You Should Too, When It’s Available  https://t.co/9aULfpYb6Y @GeorgeForeman #Vac…",0,3,True
395,1352766661611442181,pottobaggie,North Yorkshire et La Charente,"Black Country boy. Half man, half throstle. In love with Uma and The Albion. Hair, teeth and views my own.",2010-04-02 09:13:04,405,2021-01-22 23:54:39,"RT @cpeedell: Very emotional listening to my wife who has been giving #COVID19 vaccines in Nursing Homes, Residential Care Homes, EMIs, and…",0,31,True
396,1352766587179311104,Uk1982,,,2019-08-29 13:14:53,0,2021-01-22 23:54:22,"RT @DrNeilStone: Israel vaccinating the fastest by far but the UK a very respectable second and speeding up all the time.

Finally somethin…",0,29,True
397,1352765065431310338,michot_G,"Washington, DC",Software Engineer. Technology Enthusiast.,2011-06-19 18:13:37,4048,2021-01-22 23:48:19,Just got my first dose of Pfizer Vaccine.  #VaccinesSaveLives https://t.co/0Xdh5huHNC,3,0,False
398,1352764145796599808,AshTuite,"Toronto, Ontario","Infectious Disease Epidemiologist and Math Modeler @UofT_dlsph, Data Raccoon, Cat Fancier",2011-05-01 21:08:46,11537,2021-01-22 23:44:40,"RT @FPharmacy5: 💁‍♀️New Friendly Pharmacy 5 video! 

Covid-19 Vaccine Questions Answered: Part 1 https://t.co/FkG47i7syj

#ScienceUpFirst #…",0,10,True
399,1352764004884733953,MikeRoseMDMPH,,"CordMN➡️HSPH➡️UMNMed➡️ Hopkins Med-Peds. Team member @CPSolvers. Generalist in all things. Randomista. Tweets in character, not necessarily on brand.",2012-02-06 17:58:00,1636,2021-01-22 23:44:06,"RT @tmprowell: As of 1/21/21, 4.6% of the 🇺🇸 have received at least 1 dose of #COVID19 #vaccine &amp; 0.7% have gotten both needed shots in the…",0,30,True
400,1352763675275386883,RD_Durman,,"Clinical Lead Renal Dietitian at Bart's Health NHS Trust, London. 
Tweeting my own views",2018-08-31 09:26:40,229,2021-01-22 23:42:47,RT @RRajakariar: Day 1 of the covid-19 vaccination drive at our Newham dialysis unit. More than a 90% uptake of the vaccine administered by…,0,2,True
401,1352763169119334404,SusanPearson50,,"Freelance comms, journalist & writer, especially on environment & medicine - including lots on infection control. Mask wearer. Views mine only.  #NHSblueheart",2012-07-02 11:05:35,283,2021-01-22 23:40:47,"RT @cpeedell: Very emotional listening to my wife who has been giving #COVID19 vaccines in Nursing Homes, Residential Care Homes, EMIs, and…",0,31,True
402,1352762915565133824,counselorjosue,"California, USA","Latinx School Counselor, #BlackTransLivesMatter He, Him, His Masters of Science, Educational Counseling Pupil, Personnel, Services Credential",2020-08-05 19:39:36,189,2021-01-22 23:39:46,"Grateful to have been given this opportunity today 
Trusting science wearing masks and very soon having more access… https://t.co/8xrYP67quA",1,0,False
403,1352762050091614211,s9tmt,manchester,"Volunteer SRFT,Co Founder Headsmatter,Passionate about Brain Injury,PTSD All views are my own",2011-04-08 18:55:55,6487,2021-01-22 23:36:20,"RT @cpeedell: Very emotional listening to my wife who has been giving #COVID19 vaccines in Nursing Homes, Residential Care Homes, EMIs, and…",0,31,True
404,1352761386405916673,Artboy1,South East England,"Artist, Printmaker and Teacher (no longer full-time!)",2009-05-28 01:25:05,3079,2021-01-22 23:33:42,"RT @cpeedell: Very emotional listening to my wife who has been giving #COVID19 vaccines in Nursing Homes, Residential Care Homes, EMIs, and…",0,31,True
405,1352760439235637249,estopandshop,"Hamilton, Ontario",,2018-03-04 19:25:14,431,2021-01-22 23:29:56,RT @Vaxyourfam: Getting #vaccinated is the best and safest way to keep healthy kids healthy. Learn about #vaccine-preventable #diseases lik…,0,5,True
406,1352760289352151040,KwadCast,"Ottawa, Ontario",The podcast about healthcare innovation and improving healthcare delivery. Hosted by @kwadwo777. In association with @ResourceOptNet,2019-08-29 18:56:42,3414,2021-01-22 23:29:20,"RT @FPharmacy5: 💁‍♀️New Friendly Pharmacy 5 video! 

Covid-19 Vaccine Questions Answered: Part 1 https://t.co/FkG47i7syj

#ScienceUpFirst #…",0,10,True
407,1352759970173882369,ImmunizeCa,California,Promoting science to protect California from preventable diseases. #DontWaitVaccinate #VaccinesWork #WearAMaskCA #PublicHealth #IVax2Protect,2008-11-19 23:56:31,2071,2021-01-22 23:28:04,RT @Vaxyourfam: Getting #vaccinated is the best and safest way to keep healthy kids healthy. Learn about #vaccine-preventable #diseases lik…,0,5,True
408,1352759826871431171,yusufhameed,"Savannah, GA","Anesthesiologist, Pain Management Fellowship, Entrepreneur, Angel Investor.  Aetho, Vireo Labs, C'reer, Enviroflight (now Intrexon/Precigen).",2009-06-14 16:30:25,1124,2021-01-22 23:27:30,@megtirrell @DrPaulOffit @angie_rasmussen @EmoryMedicine Please let teacher unions not wanting to teach in 2021-202… https://t.co/B05mNbchay,0,0,False
409,1352759586579742722,gillvray,"Cambridge, England",GP with special interest in Mental Health and Sports Medicine,2009-02-18 11:41:41,143,2021-01-22 23:26:33,"Feeling excited to be vaccinating tomorrow in Over, Cambridgeshire. Glad to play a part in stopping the virus hitti… https://t.co/uQUBWL91al",3,2,True
410,1352759505017139200,benrosenberg,"Los Angeles, CA","People person.

B.A. @Stanford 2014 | Ph.D. @UCLA ~2090",2011-10-30 21:32:48,209,2021-01-22 23:26:13,"So proud of @ellenkettler, who is spending the whole day volunteering with the @UCSDHealth vaccination superstation… https://t.co/VXdK0KDitK",5,0,False
411,1352759273760174081,WhyImmunize,"Phoenix, AZ","The Arizona Partnership for Immunization (TAPI) is a non-profit, state-wide coalition. TAPI develops programs & educates about vaccine preventable diseases.",2009-09-16 20:39:20,812,2021-01-22 23:25:18,RT @NursesWhoVax: Get a Good Night's Sleep Before Your COVID Vaccine because adequate sleep is an important factor in a strong immune syste…,0,3,True
412,1352758061417508864,kmstphns,"Dallas, TX",Health communication and education champion dedicated to advancing America's health security. #Epi #Preparedness,2012-08-24 11:35:53,170,2021-01-22 23:20:29,"That's a wrap. #COVID19 mass vaccination clinic #2 is complete ✅ 2,872 vaccinated today 💪💉 #medicalreservecorps… https://t.co/NdNGHTu42d",1,0,False
413,1352757660928651272,DesmondMcCarey2,"East London, England",Writer of 'Food and Enterprise ' !Developing maths learning in  primary and secondary  against the tide of downloads ! Writing 'Maths- Practical Progression',2015-10-26 11:50:12,1242,2021-01-22 23:18:54,"RT @LSHTM: Safe &amp; effective #COVID19 vaccines are close.

But their development is just the beginning - so what's next? 🤔

Put your questio…",0,35,True
414,1352757082999676929,N1CKW1NSTON,,• Creative • Director • Choreographer • he/him • 🎥 Tomorrow Morning | The Royal Variety | Miranda Hart | Sondheim Prom | 🎭 Mame | Annie | Fame | Rock Of Ages,2010-05-20 06:39:29,10039,2021-01-22 23:16:36,"RT @DrNeilStone: Israel vaccinating the fastest by far but the UK a very respectable second and speeding up all the time.

Finally somethin…",0,29,True
415,1352757039588630528,Doctora4kids,"Kansas City, MO","Mother | Pediatric Infectious Diseases Doc | Vaccine Advocate| Teacher/ Researcher-Separating fact from fiction #ImmigrantsGetTheJobDone, #tweetiatrician",2012-02-13 23:19:52,187,2021-01-22 23:16:25,Got my covid shot! #sittingwithbernie #VaccinesSaveLives  #CoronavirusVaccine #Iamnotgivingupmyshot @SenSanders https://t.co/5nlWSOGmHF,3,0,False
416,1352756932503863296,ECandella,,"#epicsketches Custom “Doodles” commercial real estate professional, attorney",2012-12-26 16:16:48,198,2021-01-22 23:16:00,@NyProtect @Mingling1231 @discangirl @ritamollerpalma @HPVSideEffects LoL! Ms or Mr @NyProtect  Which… https://t.co/9y3W8zW9Rk,1,0,False
417,1352756884705570818,ornarichella,Ireland,Trotting head first through life trying to avoid the disconnect. Personal account. Edited highlights from my head (and things that tickle my fancy).,2009-06-06 18:25:10,249,2021-01-22 23:15:48,RT @RCPI_news: An information document with FAQs about COVID-19 vaccines for people with pre-existing allergic conditions has been produced…,0,34,True
418,1352755947089797121,tiredpregnantla,"San Jose, CA",Tired. Pregnant. But still a lady!,2014-10-09 23:42:45,139,2021-01-22 23:12:05,"@GavinNewsom. The plan to do away with tiers for vaccines is devastating news to essential workers, esp. those with… https://t.co/1cCxy3daBN",0,0,False
419,1352755422143410178,shudderer,Dublin,,2010-08-05 15:47:44,44,2021-01-22 23:10:00,"RT @mairenihuigin: Y’know, this high take up of the #covid vaccine by front line healthcare workers of all levels, grades &amp; specialities is…",0,63,True
420,1352754943816396801,DrSCohen,"Pasadena, CA",Assistant Clinical Professor | @cityofhope | @CityofHopeSurg | #FPMRS | Views Mine | RTs≠E,2014-04-06 01:09:15,1305,2021-01-22 23:08:06,RT @AmerMedicalAssn: Looking for the latest in #COVID19 vaccine developments? We've compiled updated science and evidence-based resources o…,0,3,True
421,1352754471839920131,tahira_sunshine,"London, England",Pharmacist| trying to contribute towards betterment of humanity/ would fight for fair society with justice at its core for everyone,2012-10-01 23:55:08,264,2021-01-22 23:06:13,"RT @cpeedell: Very emotional listening to my wife who has been giving #COVID19 vaccines in Nursing Homes, Residential Care Homes, EMIs, and…",0,31,True
422,1352754249034313728,GrooveGrl4,The Palmetto State,"Stay at home parent. Background in anthropology, women/gender studies, and accountancy. Chronic pain/chronic illness. #BlackLivesMatter She/her 🏳️‍🌈💖💜💙",2011-05-11 00:14:33,607,2021-01-22 23:05:20,"RT @tmprowell: As of 1/21/21, 4.6% of the 🇺🇸 have received at least 1 dose of #COVID19 #vaccine &amp; 0.7% have gotten both needed shots in the…",0,30,True
423,1352754093979267072,CaptSchuck,,Love life and life loves you!,2011-09-11 03:33:00,94,2021-01-22 23:04:43,Why do I allow myself to read comment threads from anti-vaxxers? It just makes me angry. #VaccinesSaveLives #DontBeDumb,0,0,False
424,1352754020218249221,nickybermuda,,,2012-05-16 21:58:06,29,2021-01-22 23:04:26,"RT @ghanchif: @1MaxMclean @FullFact Stats can be numbingly cold, but the sheer scale of numbers (UK and global) scream: more than enough ha…",0,1,True
425,1352753562711822336,donnac58,"Oceanside, CA","Protesting against Trump! County coordinator, webmaster, genealogist, historian, traveler, cat lover, Democrat & published romance author - that's me.",2011-01-18 06:00:31,3495,2021-01-22 23:02:36,"I got vaccinated today! 

A big shout out to the workers who are helping to save all of us, old and young, black an… https://t.co/kR990gj7WH",0,0,False
426,1352753451508264960,iXeno,SF Bay Area,"Neuroscience, etc. Professor of Humans @CalStateEastBay, guests on Chochenyo-Ohlone land. CEO Buzzy Linhart Music  #HealthyAging #BrainHealth #BrainMusic",2009-09-18 17:11:05,834,2021-01-22 23:02:10,@aka_anastazia @alexmichelle822 @jaketapper Sowing doubt is way easier than following the science. We lectured on t… https://t.co/0ypkYpy2aM,2,0,False
427,1352753159228305413,johnmcgh33,"Edinburgh, Scotland","New profile November 2020 - PhD student: deaths post custody in Scotland. Links between deprivation, poverty and post-prison survival.",2020-11-26 03:13:46,193,2021-01-22 23:01:00,RT @djbradshaw64: @greggwatson90 Take advice from the health care professionals of course.  But it’s been tested on tens of thousands of wi…,0,2,True
428,1352753051820568576,istackpole,"Newport, RI","Healthcare consultant|
President, Stackpole & Associates, Inc. |
Co-host, The Medical Travel Show",2012-01-02 13:55:19,1157,2021-01-22 23:00:35,"This is just ""not cool"". More than 16,000 vaccine doses potentially spoiled in Maine and Michigan by temperature pr… https://t.co/ft3zHqhucj",0,0,False
429,1352752926662549505,monitor_PH,,"Surveying the field of Public Health. Maintained by @thisisdaryn.

Curation of sources is a work in progress. Send feedback to darynr at gmail.",2017-05-31 17:21:27,1321,2021-01-22 23:00:05,RT @AmerMedicalAssn: Looking for the latest in #COVID19 vaccine developments? We've compiled updated science and evidence-based resources o…,0,3,True
430,1352752909595914241,AmerMedicalAssn,Chicago/Washington D.C.,American Medical Association: Physicians' powerful ally in patient care. [RT ≠ Endorsement] #MembersMoveMedicine @AMAmedstudents,2009-03-31 17:50:31,740547,2021-01-22 23:00:01,Looking for the latest in #COVID19 vaccine developments? We've compiled updated science and evidence-based resource… https://t.co/r25qwb4YwH,4,3,True
431,1352752809935056900,Shensheen1,Nairobi,Blessed b the Lord,2010-11-17 13:29:30,2036,2021-01-22 22:59:37,"RT @DrNeilStone: Israel vaccinating the fastest by far but the UK a very respectable second and speeding up all the time.

Finally somethin…",0,29,True
432,1352752566652833792,Connorsherry3,Northfield Birmingham ,"Footballer & Club Captain For Aston Villa Foundation Ability Counts Single 20 Years Old
🦁💜💙",2017-03-05 11:24:31,1894,2021-01-22 22:58:39,"RT @cpeedell: Very emotional listening to my wife who has been giving #COVID19 vaccines in Nursing Homes, Residential Care Homes, EMIs, and…",0,31,True
433,1352752538727161857,djbradshaw64,,"Microbiologist by trade & training. Family, horse racing, football #COYS, curries & red wine my passions outside work.",2011-01-15 20:56:05,24597,2021-01-22 22:58:32,@greggwatson90 Take advice from the health care professionals of course.  But it’s been tested on tens of thousands… https://t.co/F9lc1L2rWL,70,2,True
434,1352751912488230914,harbro,London,"Writer, editor, researcher, speaker, historian. Feminism, fashion, football, health, social care. NUJ. Views my own. Obviously.",2009-02-22 22:30:51,863,2021-01-22 22:56:03,"RT @cpeedell: Very emotional listening to my wife who has been giving #COVID19 vaccines in Nursing Homes, Residential Care Homes, EMIs, and…",0,31,True
435,1352751467640324097,Arefsahar3,,"The world is not a better place, If the people of Yemen is left unnoticed. #PrayForYemen",2021-01-20 13:32:37,0,2021-01-22 22:54:17,"RT @UNICEF_Yemen: And today, children in #Socotra governorate started receiving their vaccines as part of the integrated #Polio and Vitamin…",0,13,True
436,1352751419187724288,Arefsahar3,,"The world is not a better place, If the people of Yemen is left unnoticed. #PrayForYemen",2021-01-20 13:32:37,0,2021-01-22 22:54:05,RT @UNICEF_Yemen: Mahmoud Ali is a one-year old child who was vaccinated against #polio during the integrated #Polio and vitamin (A) campai…,0,7,True
437,1352751394382622720,maureenzielins1,"Wauwatosa, WI",,2015-05-24 18:26:45,45,2021-01-22 22:53:59,RT @halltoons: Today’s syndicate cartoon. #vaccine #VaccinesSaveLives #VaccinationDrive @AprilDRyan @VLADDO @abbydphillip @laloalcaraz @Mag…,0,31,True
438,1352751323062665218,allergyfairyUK,Dublin ,"News, advocacy and general info about #allergies #asthma and #anaphylaxis. Board Member of @AnaphylaxisIRL. Think #14allergens and always #carrytwo",2014-12-09 13:12:14,998,2021-01-22 22:53:42,RT @RCPI_news: An information document with FAQs about COVID-19 vaccines for people with pre-existing allergic conditions has been produced…,0,34,True
